Question,Answer URL,Answer Label,Question Rating,Answer Quality,Factual,questionId
Can't spoil a young baby with attention?,https://skeptics.stackexchange.com/questions/9476#19724,yes,1,1,1,9476
Is it a healthy habit to walk after having food?,https://skeptics.stackexchange.com/questions/11143#11169,no,3,3,1,11143
Would a human's blood suddenly boil (or eyes/body explode) in a vacuum?,https://skeptics.stackexchange.com/questions/8521#8524,no,3,2,1,8521
Are a third of the proteins we consume dependent on synthetic fertilizer?,https://skeptics.stackexchange.com/questions/44374#44409,no,2,1,1,44374
Does garlic enhance immune system?,https://skeptics.stackexchange.com/questions/20713#20727,yes,2,2,1,20713
Did depressed people far more accurately estimate how many monsters they killed in a video game?,https://skeptics.stackexchange.com/questions/44329#44330,na,2,3,1,44329
Did Thales conduct experiments in electricity?,https://skeptics.stackexchange.com/questions/26654#26657,yes,2,2,1,26654
Are ceramic heaters more efficient than convection heaters?,https://skeptics.stackexchange.com/questions/9167#9170,no,2,2,1,9167
Did NOAA publish a fake map with temperature data it doesn't have?,https://skeptics.stackexchange.com/questions/37119#37147,no,2,3,1,37119
Does hot water freeze faster than cold water?,https://skeptics.stackexchange.com/questions/3371#3372,yes,3,2,1,3371
Are media's portrayals of physical perfection a contributing cause of eating disorders?,https://skeptics.stackexchange.com/questions/9585#9588,no,2,2,1,9585
Does the container that soda is in affect the flavour?,https://skeptics.stackexchange.com/questions/3000#4164,yes,2,3,1,3000
Can eating too much fibre cause Hemorrhoidal disease (or piles)?,https://skeptics.stackexchange.com/questions/18573#23506,no,2,2,1,18573
Are bar peanuts regularly tainted by urine?,https://skeptics.stackexchange.com/questions/3803#3804,na,1,1,1,3803
Can hypohydrosis (inability to sweat) be caused be excess adrenaline?,https://skeptics.stackexchange.com/questions/45411#45465,no,1,2,1,45411
Do nice guys finish last?,https://skeptics.stackexchange.com/questions/3477#5230,yes,2,2,0,3477
Does your body suffer one mutation for every 15 cigarettes you smoke?,https://skeptics.stackexchange.com/questions/14299#14303,yes,2,3,1,14299
Can Sunny D turn you yellow?,https://skeptics.stackexchange.com/questions/4153#4155,yes,2,3,1,4153
Are the Vitamins L1 and L2 necessary for rats to lactate?,https://skeptics.stackexchange.com/questions/32364#32393,no,2,3,1,32364
Does eating Diatomaceous earth have these benefits?,https://skeptics.stackexchange.com/questions/34971#34990,no,2,2,1,34971
Does the 'super-moon' have a measurable effect on probability and magnitude of earthquakes?,https://skeptics.stackexchange.com/questions/35888#37979,no,2,3,1,35888
Does consuming foods rich in phytic acid prevent mineral absorption?,https://skeptics.stackexchange.com/questions/35091#35203,na,2,2,1,35091
Was Sir Isaac Newton a homosexual?,https://skeptics.stackexchange.com/questions/8017#8023,no,2,2,1,8017
Can you recharge non-rechargeable alkaline batteries?,https://skeptics.stackexchange.com/questions/4771#4803,yes,2,3,1,4771
Do Shade Balls conserve/save water?,https://skeptics.stackexchange.com/questions/28749#28751,yes,2,2,1,28749
"Does a desirable difficulty"" in reading font affect memory retention?""",https://skeptics.stackexchange.com/questions/44229#44231,na,2,3,1,44229
Does gliadin in wheat stimulate appetite to the point of obesity?,https://skeptics.stackexchange.com/questions/12272#14368,na,2,1,1,12272
Do atoms exist?,https://skeptics.stackexchange.com/questions/7801#7803,yes,2,3,1,7801
Do expensive electronic toothbrushes outperform cheaper models?,https://skeptics.stackexchange.com/questions/4961#4974,na,2,2,1,4961
Are there no naturally blue foods?,https://skeptics.stackexchange.com/questions/3410#3417,yes,2,3,1,3410
"Is treatment induced injury"" one of the leading causes of death and disability?""",https://skeptics.stackexchange.com/questions/18887#18888,na,2,2,1,18887
Is racism a natural instinct?,https://skeptics.stackexchange.com/questions/8130#8163,no,2,2,1,8130
Is it unsafe to swim during a lightning storm?,https://skeptics.stackexchange.com/questions/466#467,yes,2,2,1,466
Do women prefer taller men?,https://skeptics.stackexchange.com/questions/4409#4419,yes,2,2,1,4409
Did January 2014 American snowfall char and burn when exposed to fire?,https://skeptics.stackexchange.com/questions/19364#19365,no,2,3,1,19364
Does Heads Up Texas Hold'em have more possible hands than atoms in the universe?,https://skeptics.stackexchange.com/questions/43220#43221,no,2,3,1,43220
Did Pope John Paul II perform a miracle?,https://skeptics.stackexchange.com/questions/2835#10569,na,2,3,1,2835
Do beef farmed pastures net remove carbon emissions?,https://skeptics.stackexchange.com/questions/44684#44689,no,2,3,1,44684
Was inbreeding responsible for haemophilia in royalty?,https://skeptics.stackexchange.com/questions/23648#23649,na,2,3,1,23648
Do onions become toxic or otherwise dangerous within a day of a being cut open?,https://skeptics.stackexchange.com/questions/20649#20651,na,2,2,1,20649
Has man walked on the Moon?,https://skeptics.stackexchange.com/questions/1128#1130,yes,2,2,1,1128
Is eating fruits separately/on an empty stomach healthier?,https://skeptics.stackexchange.com/questions/16253#43309,na,2,3,1,16253
Did almost all tilapia sold in US undergo sex change?,https://skeptics.stackexchange.com/questions/38861#38866,na,2,1,1,38861
Does eating certain food types alter your body temperature?,https://skeptics.stackexchange.com/questions/29963#29982,yes,2,3,1,29963
Do recruiters hire people like themselves?,https://skeptics.stackexchange.com/questions/43927#43930,yes,2,3,1,43927
Is poisoning possible from preservative on orange zest?,https://skeptics.stackexchange.com/questions/1941#2451,na,2,3,1,1941
Can the useful lifespan of razor blades be extended by stroking them over jeans?,https://skeptics.stackexchange.com/questions/14792#15142,yes,2,1,1,14792
Is a lack of breakfast the #1 brain damaging habit?,https://skeptics.stackexchange.com/questions/14745#17587,no,2,3,1,14745
Is storing food in opened tin cans dangerous?,https://skeptics.stackexchange.com/questions/16799#16809,no,2,2,1,16799
Did Canadian company HyperStealth invent an invisibility cloak?,https://skeptics.stackexchange.com/questions/14918#14922,no,2,2,1,14918
Is Autism in Children frequently due to low Glutathione Levels?,https://skeptics.stackexchange.com/questions/14126#20822,no,2,3,1,14126
Is coconut oil the best for high-temperature cooking?,https://skeptics.stackexchange.com/questions/23317#23362,no,2,3,1,23317
Does the Eneloop battery have lower self-discharge?,https://skeptics.stackexchange.com/questions/11224#12426,yes,2,3,1,11224
Do harmful chemicals migrate from the container into the food if you microwave the food in a plastic container?,https://skeptics.stackexchange.com/questions/8671#9413,no,2,2,1,8671
Is the association between homosexuality and mental illness likely to have a genetic basis?,https://skeptics.stackexchange.com/questions/39705#39722,na,2,3,1,39705
Did most sex workers experience abuse as a child?,https://skeptics.stackexchange.com/questions/1121#44129,yes,2,2,1,1121
Can egg shells be digested?,https://skeptics.stackexchange.com/questions/14349#14350,yes,2,3,1,14349
Does water have a memory as claimed in homeopathy?,https://skeptics.stackexchange.com/questions/2#27,no,2,3,1,2
Can you melt gold in a regular campfire?,https://skeptics.stackexchange.com/questions/5849#5868,yes,3,3,1,5849
Does mifepristone (RU-486 / Korlym®) help cure depression?,https://skeptics.stackexchange.com/questions/42420#42424,yes,2,2,1,42420
Do higher CO2 concentrations increase plant well-being?,https://skeptics.stackexchange.com/questions/22292#22293,na,2,3,1,22292
Is Fructose the #1 source of obesity in the United States today?,https://skeptics.stackexchange.com/questions/34808#35245,no,2,3,1,34808
Are rising temperatures making fires worse?,https://skeptics.stackexchange.com/questions/16528#16529,yes,2,3,1,16528
Is physiotherapy effective in reducing repetitive strain injury (RSI) complaints?,https://skeptics.stackexchange.com/questions/2612#8088,na,2,2,1,2612
Do trackers hold their ears to the ground?,https://skeptics.stackexchange.com/questions/28858#31250,yes,2,3,1,28858
Is breakfast the most important meal of the day?,https://skeptics.stackexchange.com/questions/755#5928,no,2,2,1,755
Is this image of a skinny polar bear misleading?,https://skeptics.stackexchange.com/questions/43222#43224,na,1,2,1,43222
Do 40% of U.S. Americans think that global warming is unproblematic since Christ will return soon?,https://skeptics.stackexchange.com/questions/36010#36011,no,2,2,1,36010
Do Omega 3 fatty acids reduce inflammation?,https://skeptics.stackexchange.com/questions/10919#10930,na,2,3,1,10919
Does chocolate have caffeine?,https://skeptics.stackexchange.com/questions/22428#22431,yes,2,2,1,22428
Is cold-pressed juice higher in nutrients?,https://skeptics.stackexchange.com/questions/28180#28198,na,2,2,1,28180
Do 20% of Australian children think pasta comes from animals?,https://skeptics.stackexchange.com/questions/13570#13572,no,2,3,1,13570
Is learning more difficult for older people?,https://skeptics.stackexchange.com/questions/1713#1724,na,2,2,1,1713
Is it unhealthy to lick the lid of a yogurt cup?,https://skeptics.stackexchange.com/questions/27504#27602,no,2,2,1,27504
Does drinking water after eating watermelon cause cholera?,https://skeptics.stackexchange.com/questions/22241#23255,no,2,1,1,22241
Is corn oil bad for arthritis?,https://skeptics.stackexchange.com/questions/9692#22424,no,2,3,1,9692
"Insects as food: Is it feasible for humans to replace traditional livestock"" meat with insects?""",https://skeptics.stackexchange.com/questions/923#2068,na,2,2,1,923
Is the ozone in the Sharper Image Air Ionizer unhealthy or can it cause asthma?,https://skeptics.stackexchange.com/questions/3163#3165,yes,2,3,1,3163
"Is cannabis bad for your health, when not smoked, in the long term?",https://skeptics.stackexchange.com/questions/19057#19058,na,2,2,1,19057
Was Shakuntala Devi able to perform complex computations far faster than the best living human calculators?,https://skeptics.stackexchange.com/questions/20024#22842,yes,2,3,1,20024
Are there negative developmental effects for children given into early childcare?,https://skeptics.stackexchange.com/questions/3201#3227,na,2,2,1,3201
Does reading about cognitive biases improve reasoning?,https://skeptics.stackexchange.com/questions/447#551,na,2,1,1,447
"Is ET watching I Love Lucy"" right now?""",https://skeptics.stackexchange.com/questions/5141#8691,yes,1,1,0,5141
Do people exposed to high levels of radiation pose any risk to their children or other individuals?,https://skeptics.stackexchange.com/questions/974#1002,no,2,3,1,974
Is this a way to survive a lightning strike?,https://skeptics.stackexchange.com/questions/22430#26432,na,2,3,1,22430
Does our brain make ourselves look five times more beautiful than we really are?,https://skeptics.stackexchange.com/questions/7461#7492,no,2,3,1,7461
Can you tell someone is hungry based on stomach rumbling?,https://skeptics.stackexchange.com/questions/31047#31052,no,2,1,1,31047
Are we heading for a mini ice age?,https://skeptics.stackexchange.com/questions/4597#4605,no,2,2,1,4597
Does eating chocolate make you high?,https://skeptics.stackexchange.com/questions/6765#6768,yes,2,2,1,6765
Can cats survive a fall from any height?,https://skeptics.stackexchange.com/questions/3430#3431,yes,2,3,1,3430
Is sitting dangerous?,https://skeptics.stackexchange.com/questions/3257#30367,yes,2,2,1,3257
Are Vitamins ingested in natural food more effective than those ingested in supplements?,https://skeptics.stackexchange.com/questions/6837#6855,na,2,2,1,6837
Can you cause mosquitos to explode from drinking too much blood by flexing your muscles?,https://skeptics.stackexchange.com/questions/16711#16712,yes,2,2,1,16711
Does water swirl the opposite way on the other hemisphere?,https://skeptics.stackexchange.com/questions/450#451,yes,2,3,1,450
Did Jerry Rubin eat so many carrots he turned orange?,https://skeptics.stackexchange.com/questions/43419#43421,yes,2,2,1,43419
"Is eating cloven-hoofed animals, bottom-feeders or ruminants bad for you?",https://skeptics.stackexchange.com/questions/2330#2347,na,2,1,1,2330
Is cancer linked to having an acidic body?,https://skeptics.stackexchange.com/questions/20087#20093,na,2,3,1,20087
Are decorative magnets on refrigerator dangerous?,https://skeptics.stackexchange.com/questions/4459#4617,no,2,3,1,4459
Can a man fall faster than the speed of sound?,https://skeptics.stackexchange.com/questions/11162#11166,yes,2,3,1,11162
Can reading a word trigger a trauma flashback?,https://skeptics.stackexchange.com/questions/18951#36740,yes,2,1,1,18951
